{
  "id": "nautical-flags",
  "name": "Nautical Flags",
  "version": "1.0.0",
  "sourceUrl": "https://github.com/qant-au/reticulyne/tree/main/packs/nautical-flags",
  "media": [
    {
      "id": "halyard",
      "name": "Halyard",
      "family": "marine-vehicle",
      "topology": "point-to-point",
      "connectors": [
        "snap-shackle"
      ]
    }
  ],
  "icons": [
    {
      "id": "nautical-flags-alfa",
      "name": "Alfa (A)",
      "url": "data:image/svg+xml,%3Csvg%20xmlns%3D%22http%3A%2F%2Fwww.w3.org%2F2000%2Fsvg%22%20viewBox%3D%220%200%2064%2064%22%3E%3Cellipse%20cx%3D%2218%22%20cy%3D%2256%22%20rx%3D%227%22%20ry%3D%223.5%22%20fill%3D%22%23c5cdda%22%20stroke%3D%22%2316213d%22%20stroke-width%3D%221.4%22%2F%3E%3Crect%20x%3D%2216.5%22%20y%3D%226%22%20width%3D%223%22%20height%3D%2250%22%20fill%3D%22%23e9edf3%22%20stroke%3D%22%2316213d%22%20stroke-width%3D%221.4%22%20stroke-linejoin%3D%22round%22%2F%3E%3Ccircle%20cx%3D%2218%22%20cy%3D%225%22%20r%3D%222.2%22%20fill%3D%22%23c5cdda%22%20stroke%3D%22%2316213d%22%20stroke-width%3D%221.4%22%2F%3E%3CclipPath%20id%3D%22f%22%3E%3Cpolygon%20points%3D%2218%2C9%2040.52%2C22%2034.89%2C31.75%2040.52%2C48%2018%2C35%22%2F%3E%3C%2FclipPath%3E%3Cg%20clip-path%3D%22url(%23f)%22%3E%3Cpolygon%20points%3D%2218%2C9%2029.26%2C15.5%2029.26%2C41.5%2018%2C35%22%20fill%3D%22%23FFFFFF%22%2F%3E%3Cpolygon%20points%3D%2229.26%2C15.5%2040.52%2C22%2040.52%2C48%2029.26%2C41.5%22%20fill%3D%22%2300247D%22%2F%3E%3C%2Fg%3E%3Cpolygon%20points%3D%2218%2C9%2040.52%2C22%2034.89%2C31.75%2040.52%2C48%2018%2C35%22%20fill%3D%22none%22%20stroke%3D%22%2316213d%22%20stroke-width%3D%221.4%22%20stroke-linejoin%3D%22round%22%2F%3E%3C%2Fsvg%3E",
      "isIsometric": true,
      "flatUrl": "data:image/svg+xml,%3Csvg%20xmlns%3D%22http%3A%2F%2Fwww.w3.org%2F2000%2Fsvg%22%20viewBox%3D%220%200%2048%2048%22%3E%3Crect%20x%3D%226%22%20y%3D%225%22%20width%3D%223%22%20height%3D%2239%22%20fill%3D%22%23c5cdda%22%20stroke%3D%22%2316213d%22%20stroke-width%3D%221.2%22%20stroke-linejoin%3D%22round%22%2F%3E%3CclipPath%20id%3D%22f%22%3E%3Cpolygon%20points%3D%229%2C7%2036%2C7%2029.25%2C20.5%2036%2C34%209%2C34%22%2F%3E%3C%2FclipPath%3E%3Cg%20clip-path%3D%22url(%23f)%22%3E%3Cpolygon%20points%3D%229%2C7%2022.5%2C7%2022.5%2C34%209%2C34%22%20fill%3D%22%23FFFFFF%22%2F%3E%3Cpolygon%20points%3D%2222.5%2C7%2036%2C7%2036%2C34%2022.5%2C34%22%20fill%3D%22%2300247D%22%2F%3E%3C%2Fg%3E%3Cpolygon%20points%3D%229%2C7%2036%2C7%2029.25%2C20.5%2036%2C34%209%2C34%22%20fill%3D%22none%22%20stroke%3D%22%2316213d%22%20stroke-width%3D%221.2%22%20stroke-linejoin%3D%22round%22%2F%3E%3Crect%20x%3D%224%22%20y%3D%2242%22%20width%3D%227%22%20height%3D%222.5%22%20fill%3D%22%23c5cdda%22%20stroke%3D%22%2316213d%22%20stroke-width%3D%221.2%22%20stroke-linejoin%3D%22round%22%2F%3E%3C%2Fsvg%3E",
      "family": "marine-vehicle",
      "description": "I have a diver down; keep well clear at slow speed.",
      "ports": [
        {
          "id": "hoist-top",
          "name": "Hoist top",
          "medium": "halyard",
          "connector": "snap-shackle"
        },
        {
          "id": "hoist-bottom",
          "name": "Hoist bottom",
          "medium": "halyard",
          "connector": "snap-shackle"
        }
      ]
    },
    {
      "id": "nautical-flags-bravo",
      "name": "Bravo (B)",
      "url": "data:image/svg+xml,%3Csvg%20xmlns%3D%22http%3A%2F%2Fwww.w3.org%2F2000%2Fsvg%22%20viewBox%3D%220%200%2064%2064%22%3E%3Cellipse%20cx%3D%2218%22%20cy%3D%2256%22%20rx%3D%227%22%20ry%3D%223.5%22%20fill%3D%22%23c5cdda%22%20stroke%3D%22%2316213d%22%20stroke-width%3D%221.4%22%2F%3E%3Crect%20x%3D%2216.5%22%20y%3D%226%22%20width%3D%223%22%20height%3D%2250%22%20fill%3D%22%23e9edf3%22%20stroke%3D%22%2316213d%22%20stroke-width%3D%221.4%22%20stroke-linejoin%3D%22round%22%2F%3E%3Ccircle%20cx%3D%2218%22%20cy%3D%225%22%20r%3D%222.2%22%20fill%3D%22%23c5cdda%22%20stroke%3D%22%2316213d%22%20stroke-width%3D%221.4%22%2F%3E%3CclipPath%20id%3D%22f%22%3E%3Cpolygon%20points%3D%2218%2C9%2040.52%2C22%2034.89%2C31.75%2040.52%2C48%2018%2C35%22%2F%3E%3C%2FclipPath%3E%3Cg%20clip-path%3D%22url(%23f)%22%3E%3Cpolygon%20points%3D%2218%2C9%2040.52%2C22%2040.52%2C48%2018%2C35%22%20fill%3D%22%23D6001C%22%2F%3E%3C%2Fg%3E%3Cpolygon%20points%3D%2218%2C9%2040.52%2C22%2034.89%2C31.75%2040.52%2C48%2018%2C35%22%20fill%3D%22none%22%20stroke%3D%22%2316213d%22%20stroke-width%3D%221.4%22%20stroke-linejoin%3D%22round%22%2F%3E%3C%2Fsvg%3E",
      "isIsometric": true,
      "flatUrl": "data:image/svg+xml,%3Csvg%20xmlns%3D%22http%3A%2F%2Fwww.w3.org%2F2000%2Fsvg%22%20viewBox%3D%220%200%2048%2048%22%3E%3Crect%20x%3D%226%22%20y%3D%225%22%20width%3D%223%22%20height%3D%2239%22%20fill%3D%22%23c5cdda%22%20stroke%3D%22%2316213d%22%20stroke-width%3D%221.2%22%20stroke-linejoin%3D%22round%22%2F%3E%3CclipPath%20id%3D%22f%22%3E%3Cpolygon%20points%3D%229%2C7%2036%2C7%2029.25%2C20.5%2036%2C34%209%2C34%22%2F%3E%3C%2FclipPath%3E%3Cg%20clip-path%3D%22url(%23f)%22%3E%3Cpolygon%20points%3D%229%2C7%2036%2C7%2036%2C34%209%2C34%22%20fill%3D%22%23D6001C%22%2F%3E%3C%2Fg%3E%3Cpolygon%20points%3D%229%2C7%2036%2C7%2029.25%2C20.5%2036%2C34%209%2C34%22%20fill%3D%22none%22%20stroke%3D%22%2316213d%22%20stroke-width%3D%221.2%22%20stroke-linejoin%3D%22round%22%2F%3E%3Crect%20x%3D%224%22%20y%3D%2242%22%20width%3D%227%22%20height%3D%222.5%22%20fill%3D%22%23c5cdda%22%20stroke%3D%22%2316213d%22%20stroke-width%3D%221.2%22%20stroke-linejoin%3D%22round%22%2F%3E%3C%2Fsvg%3E",
      "family": "marine-vehicle",
      "description": "I am taking in, discharging or carrying dangerous goods.",
      "ports": [
        {
          "id": "hoist-top",
          "name": "Hoist top",
          "medium": "halyard",
          "connector": "snap-shackle"
        },
        {
          "id": "hoist-bottom",
          "name": "Hoist bottom",
          "medium": "halyard",
          "connector": "snap-shackle"
        }
      ]
    },
    {
      "id": "nautical-flags-charlie",
      "name": "Charlie (C)",
      "url": "data:image/svg+xml,%3Csvg%20xmlns%3D%22http%3A%2F%2Fwww.w3.org%2F2000%2Fsvg%22%20viewBox%3D%220%200%2064%2064%22%3E%3Cellipse%20cx%3D%2218%22%20cy%3D%2256%22%20rx%3D%227%22%20ry%3D%223.5%22%20fill%3D%22%23c5cdda%22%20stroke%3D%22%2316213d%22%20stroke-width%3D%221.4%22%2F%3E%3Crect%20x%3D%2216.5%22%20y%3D%226%22%20width%3D%223%22%20height%3D%2250%22%20fill%3D%22%23e9edf3%22%20stroke%3D%22%2316213d%22%20stroke-width%3D%221.4%22%20stroke-linejoin%3D%22round%22%2F%3E%3Ccircle%20cx%3D%2218%22%20cy%3D%225%22%20r%3D%222.2%22%20fill%3D%22%23c5cdda%22%20stroke%3D%22%2316213d%22%20stroke-width%3D%221.4%22%2F%3E%3CclipPath%20id%3D%22f%22%3E%3Cpolygon%20points%3D%2218%2C9%2040.52%2C22%2040.52%2C48%2018%2C35%22%2F%3E%3C%2FclipPath%3E%3Cg%20clip-path%3D%22url(%23f)%22%3E%3Cpolygon%20points%3D%2218%2C9%2040.52%2C22%2040.52%2C27.2%2018%2C14.2%22%20fill%3D%22%2300247D%22%2F%3E%3Cpolygon%20points%3D%2218%2C14.2%2040.52%2C27.2%2040.52%2C32.4%2018%2C19.4%22%20fill%3D%22%23FFFFFF%22%2F%3E%3Cpolygon%20points%3D%2218%2C19.4%2040.52%2C32.4%2040.52%2C37.6%2018%2C24.6%22%20fill%3D%22%23D6001C%22%2F%3E%3Cpolygon%20points%3D%2218%2C24.6%2040.52%2C37.6%2040.52%2C42.8%2018%2C29.8%22%20fill%3D%22%23FFFFFF%22%2F%3E%3Cpolygon%20points%3D%2218%2C29.8%2040.52%2C42.8%2040.52%2C48%2018%2C35%22%20fill%3D%22%2300247D%22%2F%3E%3C%2Fg%3E%3Cpolygon%20points%3D%2218%2C9%2040.52%2C22%2040.52%2C48%2018%2C35%22%20fill%3D%22none%22%20stroke%3D%22%2316213d%22%20stroke-width%3D%221.4%22%20stroke-linejoin%3D%22round%22%2F%3E%3C%2Fsvg%3E",
      "isIsometric": true,
      "flatUrl": "data:image/svg+xml,%3Csvg%20xmlns%3D%22http%3A%2F%2Fwww.w3.org%2F2000%2Fsvg%22%20viewBox%3D%220%200%2048%2048%22%3E%3Crect%20x%3D%226%22%20y%3D%225%22%20width%3D%223%22%20height%3D%2239%22%20fill%3D%22%23c5cdda%22%20stroke%3D%22%2316213d%22%20stroke-width%3D%221.2%22%20stroke-linejoin%3D%22round%22%2F%3E%3CclipPath%20id%3D%22f%22%3E%3Cpolygon%20points%3D%229%2C7%2036%2C7%2036%2C34%209%2C34%22%2F%3E%3C%2FclipPath%3E%3Cg%20clip-path%3D%22url(%23f)%22%3E%3Cpolygon%20points%3D%229%2C7%2036%2C7%2036%2C12.4%209%2C12.4%22%20fill%3D%22%2300247D%22%2F%3E%3Cpolygon%20points%3D%229%2C12.4%2036%2C12.4%2036%2C17.8%209%2C17.8%22%20fill%3D%22%23FFFFFF%22%2F%3E%3Cpolygon%20points%3D%229%2C17.8%2036%2C17.8%2036%2C23.2%209%2C23.2%22%20fill%3D%22%23D6001C%22%2F%3E%3Cpolygon%20points%3D%229%2C23.2%2036%2C23.2%2036%2C28.6%209%2C28.6%22%20fill%3D%22%23FFFFFF%22%2F%3E%3Cpolygon%20points%3D%229%2C28.6%2036%2C28.6%2036%2C34%209%2C34%22%20fill%3D%22%2300247D%22%2F%3E%3C%2Fg%3E%3Cpolygon%20points%3D%229%2C7%2036%2C7%2036%2C34%209%2C34%22%20fill%3D%22none%22%20stroke%3D%22%2316213d%22%20stroke-width%3D%221.2%22%20stroke-linejoin%3D%22round%22%2F%3E%3Crect%20x%3D%224%22%20y%3D%2242%22%20width%3D%227%22%20height%3D%222.5%22%20fill%3D%22%23c5cdda%22%20stroke%3D%22%2316213d%22%20stroke-width%3D%221.2%22%20stroke-linejoin%3D%22round%22%2F%3E%3C%2Fsvg%3E",
      "family": "marine-vehicle",
      "description": "Affirmative.",
      "ports": [
        {
          "id": "hoist-top",
          "name": "Hoist top",
          "medium": "halyard",
          "connector": "snap-shackle"
        },
        {
          "id": "hoist-bottom",
          "name": "Hoist bottom",
          "medium": "halyard",
          "connector": "snap-shackle"
        }
      ]
    },
    {
      "id": "nautical-flags-delta",
      "name": "Delta (D)",